{"assignments":[{"applicability":"required","authoring_action":"set_attribute","derivation":null,"fact_key":"attribute:OverallHeight","operation_id":"fill-door-1","ownership":"occurrence_direct","provenance":["operation:fill-door-1","registered-door-parameter-policy:0.1"],"scope":"door_occurrence","source_fact_key":"attribute:OverallHeight","source_kind":"deterministic_derived","source_ref":"resolved:/operations/fill-door-1/parameters/door","unit":null,"value":2480.0,"value_type":"IfcPositiveLengthMeasure"},{"applicability":"required","authoring_action":"set_attribute","derivation":null,"fact_key":"attribute:OverallWidth","operation_id":"fill-door-1","ownership":"occurrence_direct","provenance":["operation:fill-door-1","registered-door-parameter-policy:0.1"],"scope":"door_occurrence","source_fact_key":"attribute:OverallWidth","source_kind":"deterministic_derived","source_ref":"resolved:/operations/fill-door-1/parameters/door","unit":null,"value":800.0,"value_type":"IfcPositiveLengthMeasure"},{"applicability":"conditional","authoring_action":"reuse_material","derivation":null,"fact_key":"material:u-a5e18d03df48f587","operation_id":"fill-door-1","ownership":"occurrence_direct","provenance":["request-source:user_request","request-evidence:request:/text","operation:fill-door-1"],"scope":"door_occurrence","source_fact_key":"material:u-a5e18d03df48f587","source_kind":"explicit_value","source_ref":"request:/text","unit":null,"value":"深灰铝合金","value_type":"IfcMaterial"},{"applicability":"required","authoring_action":"bind_relationship","derivation":null,"fact_key":"relationship:host","operation_id":"fill-door-1","ownership":"occurrence_direct","provenance":["operation:fill-door-1","resolved-target:2IUEnGd5v4Yfg1ZkLtd0qa","current-host-relationship:2HNE4WMQ1CXebZMaih8XoD"],"scope":"door_occurrence","source_fact_key":"relationship:host","source_kind":"deterministic_derived","source_ref":"current-relationship:host:2HNE4WMQ1CXebZMaih8XoD","unit":null,"value":"2HNE4WMQ1CXebZMaih8XoD","value_type":"IfcWallStandardCase"},{"applicability":"required","authoring_action":"bind_relationship","derivation":null,"fact_key":"relationship:storey","operation_id":"fill-door-1","ownership":"occurrence_direct","provenance":["resolved-host-target:2IUEnGd5v4Yfg1ZkLtd0qa","operation:fill-door-1"],"scope":"door_occurrence","source_fact_key":"relationship:storey","source_kind":"deterministic_derived","source_ref":"current-target-storey:1vTeahUkP60PdWqwCTjSGJ","unit":null,"value":"1vTeahUkP60PdWqwCTjSGJ","value_type":"IfcBuildingStorey"},{"applicability":"required","authoring_action":"inherit_from_type","derivation":{"formal_attributes":{"construction_type":"NOTDEFINED","operation_type":"SINGLE_SWING_LEFT","parameter_takes_precedence":false,"sizeable":false},"ifc_class":"IfcDoorStyle","template":{"construction_type":"NOTDEFINED","name":"Text2IFC generated door type fill-door-1","operation_type":"SINGLE_SWING_LEFT","parameter_takes_precedence":false,"sizeable":false},"template_digest":"sha256:ff4bd662669b204c657041d90fb711b2048932ce4d17f0dfb8ba827dee5211d6","template_id":"text2ifc-door-single-swing-template","template_version":"0.1"},"fact_key":"relationship:type","operation_id":"fill-door-1","ownership":"type_inherited","provenance":["operation:fill-door-1","generated-type-template:0.1"],"scope":"door_occurrence","source_fact_key":"relationship:type","source_kind":"deterministic_derived","source_ref":"generated-type:0WoH87ta9SIeiUjweTyLpY","unit":null,"value":"0WoH87ta9SIeiUjweTyLpY","value_type":"IfcDoorStyle"}],"base_model_fingerprint":"sha256:4a0116d439bcc286e501f459afb4fe31c9607d9233f18fb373921d991c436e66","manifest_id":"semantic-manifest-2e331e9073ed92f812646e32","operation_id":"fill-door-1","operation_type":"fill_existing_opening_with_door","policy":{"policy_id":"door.fill-existing-opening.l2","policy_version":"0.1"},"schema_version":"text2ifc/ifc-repair-semantic-manifest/0.3"}
