{"assignments":[{"applicability":"required","authoring_action":"set_attribute","derivation":null,"fact_key":"attribute:OverallHeight","operation_id":"door-2-fill-existing-opening","ownership":"occurrence_direct","provenance":["operation:door-2-fill-existing-opening","registered-door-parameter-policy:0.1"],"scope":"door_occurrence","source_fact_key":"attribute:OverallHeight","source_kind":"deterministic_derived","source_ref":"resolved:/operations/door-2-fill-existing-opening/parameters/door","unit":null,"value":2400.0,"value_type":"IfcPositiveLengthMeasure"},{"applicability":"required","authoring_action":"set_attribute","derivation":null,"fact_key":"attribute:OverallWidth","operation_id":"door-2-fill-existing-opening","ownership":"occurrence_direct","provenance":["operation:door-2-fill-existing-opening","registered-door-parameter-policy:0.1"],"scope":"door_occurrence","source_fact_key":"attribute:OverallWidth","source_kind":"deterministic_derived","source_ref":"resolved:/operations/door-2-fill-existing-opening/parameters/door","unit":null,"value":935.0,"value_type":"IfcPositiveLengthMeasure"},{"applicability":"required","authoring_action":"bind_relationship","derivation":null,"fact_key":"relationship:host","operation_id":"door-2-fill-existing-opening","ownership":"occurrence_direct","provenance":["operation:door-2-fill-existing-opening","resolved-target:1B$rgWypT66viEf30I1iIv","current-host-relationship:2HNE4WMQ1CXebZMaih8Xi_"],"scope":"door_occurrence","source_fact_key":"relationship:host","source_kind":"deterministic_derived","source_ref":"current-relationship:host:2HNE4WMQ1CXebZMaih8Xi_","unit":null,"value":"2HNE4WMQ1CXebZMaih8Xi_","value_type":"IfcWallStandardCase"},{"applicability":"required","authoring_action":"bind_relationship","derivation":null,"fact_key":"relationship:storey","operation_id":"door-2-fill-existing-opening","ownership":"occurrence_direct","provenance":["resolved-host-target:1B$rgWypT66viEf30I1iIv","operation:door-2-fill-existing-opening"],"scope":"door_occurrence","source_fact_key":"relationship:storey","source_kind":"deterministic_derived","source_ref":"current-target-storey:1vTeahUkP60PdWqwCTjSGJ","unit":null,"value":"1vTeahUkP60PdWqwCTjSGJ","value_type":"IfcBuildingStorey"},{"applicability":"required","authoring_action":"inherit_from_type","derivation":{"formal_attributes":{"construction_type":"NOTDEFINED","operation_type":"SINGLE_SWING_RIGHT","parameter_takes_precedence":false,"sizeable":false},"ifc_class":"IfcDoorStyle","template":{"construction_type":"NOTDEFINED","name":"Text2IFC generated door type door-2-fill-existing-opening","operation_type":"SINGLE_SWING_RIGHT","parameter_takes_precedence":false,"sizeable":false},"template_digest":"sha256:bac314685b5302eaf20bec014d306187af9c103fa3dcc5c0e7870d4c571453bc","template_id":"text2ifc-door-single-swing-template","template_version":"0.1"},"fact_key":"relationship:type","operation_id":"door-2-fill-existing-opening","ownership":"type_inherited","provenance":["operation:door-2-fill-existing-opening","generated-type-template:0.1"],"scope":"door_occurrence","source_fact_key":"relationship:type","source_kind":"deterministic_derived","source_ref":"generated-type:1yrYrB461T_g89hcMOBEuv","unit":null,"value":"1yrYrB461T_g89hcMOBEuv","value_type":"IfcDoorStyle"}],"base_model_fingerprint":"sha256:4a0116d439bcc286e501f459afb4fe31c9607d9233f18fb373921d991c436e66","manifest_id":"semantic-manifest-8a483a9c23491c5c6706a149","operation_id":"door-2-fill-existing-opening","operation_type":"fill_existing_opening_with_door","policy":{"policy_id":"door.fill-existing-opening.l2","policy_version":"0.1"},"schema_version":"text2ifc/ifc-repair-semantic-manifest/0.3"}
